{
  "schema_version": "0.1",
  "bundle_id": "BUNDLE-DEMO-001",
  "matter_id": "MATTER-DEMO-001",
  "scope_status": "USER_DEFINED",
  "status": "IN_PROGRESS",
  "shared_fields_record_id": "SHARED-DEMO-001",
  "deliverables": [
    {
      "deliverable_id": "D-001",
      "document_type": "起诉状",
      "requirement_level": "USER_REQUIRED",
      "requirement_source_refs": [],
      "status": "READY",
      "artifact_path": "output/起诉状.docx",
      "template_asset_id": "TPL-USER-001",
      "shared_field_ids": [
        "F-P",
        "F-AMOUNT"
      ],
      "notes": []
    },
    {
      "deliverable_id": "D-002",
      "document_type": "证据目录",
      "requirement_level": "USER_REQUIRED",
      "requirement_source_refs": [],
      "status": "STALE",
      "artifact_path": "output/证据目录.docx",
      "template_asset_id": null,
      "shared_field_ids": [
        "F-P",
        "F-AMOUNT"
      ],
      "notes": [
        "金额字段刚发生变化，待同步"
      ]
    }
  ],
  "notes": [
    "示例仅展示成套交付和联动机制，不表示任何具体法院当前必然要求这些文书。"
  ]
}
